{
  "suite": "imam-mid-ayah-pause",
  "clipId": "imam-mid-ayah-pause__pending__002-255-256",
  "status": "pending",
  "title": "Mid-ayah pause/resume",
  "description": "Pending real-imam clip: silence or gap mid-ayah then the same ayah continues. Distinct from stall-after-lock trailing pad.",
  "clips": ["qari-a/imam-mid-ayah-pause__pending__002-255-256.wav"],
  "expect": [
    { "surah": 2, "ayah": 255 },
    { "surah": 2, "ayah": 256 }
  ],
  "expected_first_lock": { "surah": 2, "ayah": 255 },
  "gate": "ordered-sequence",
  "clipRunMode": "concat",
  "insertSilence": [
    {
      "atAudioSeconds": null,
      "durationSeconds": 2.5
    }
  ],
  "notes": [
    "If the recording already contains the pause, leave insertSilence.atAudioSeconds null.",
    "Internal unvoiced frames are skipped like live mic; do not confuse with stall-after-lock fed pad.",
    "Must not jump to a wrong surah across the pause."
  ],
  "license_status": "unresolved",
  "source": "~/Desktop/zikrist-imam-clips/"
}
