{
  "suite": "imam-surah-switch",
  "clipId": "imam-surah-switch__pending__108-then-112",
  "status": "pending",
  "title": "Surah switch mid-session",
  "description": "Pending real-imam clip: Kawthar then Ikhlas in one session. Synthetic jump suite stays the 14-suite EveryAyah concat.",
  "clips": ["qari-a/imam-surah-switch__pending__108-then-112.wav"],
  "expect": [
    { "surah": 108, "ayah": 1 },
    { "surah": 108, "ayah": 2 },
    { "surah": 108, "ayah": 3 },
    { "surah": 112, "ayah": 1 },
    { "surah": 112, "ayah": 2 },
    { "surah": 112, "ayah": 3 },
    { "surah": 112, "ayah": 4 }
  ],
  "expected_first_lock": { "surah": 108, "ayah": 1 },
  "gate": "ordered-sequence",
  "clipRunMode": "concat",
  "notes": [
    "Edit expect if the dropped recording uses a different pair of surahs.",
    "Do not concatenate EveryAyah verse files and label them imam audio."
  ],
  "license_status": "unresolved",
  "source": "~/Desktop/zikrist-imam-clips/"
}
